1,Incroyable : un reste de dinosaure découvert momifié avec des traces de morsure sur sa peau !,https://www.futura-sciences.com/planete/actualites/terre-incroyable-reste-dinosaure-decouvert-momifie-traces-morsure-peau-101316/#xtor%3DRSS-8,futura-sciences,"normalement,bonne,fossilisation,squelette,dinosaure,préservation,fragments,peau,permises,enfouissement,rapide,corps,mort,découverte,fossile","Morgane Gillard, Rédactrice",https://cdn.futura-sciences.com/buildsv6/images/wide1920/2/1/d/21dfcc7931_50189963_hadrosaur-daniel-eskridge-adobestock.jpg,,"Normalement, la bonne fossilisation d’un squelette de dinosaure et notamment la préservation de fragments de peau sont permises par l’enfouissement rapide du corps après la mort. Mais la découverte d’un fossile portant des traces de morsure post-mortem dans une peau parfaitement momifiée repose...",2022-10-14 12:57:08,"<strong>Normalement</strong>, la <strong>bonne</strong> <strong>fossilisation</strong> d’un <strong>squelette</strong> de <strong>dinosaure</strong> et notamment la <strong>préservation</strong> de <strong>fragments</strong> de <strong>peau</strong> sont <strong>permises</strong> par l’<strong>enfouissement</strong> <strong>rapide</strong> du <strong>corps</strong> après la <strong>mort</strong>. Mais la <strong>découverte</strong> d’un <strong>fossile</strong> portant des traces de morsure post-mortem dans une <strong>peau</strong> parfaitement momifiée repose la question du processus de momification et de la nécessité d’un <strong>enfouissement</strong> <strong>rapide</strong>. Remontons le temps jusqu'à environ 67 millions d'années. Un <strong>dinosaure</strong> à bec de canard est en train de mourir sur les berges d'un lac. Rapidement, prédateurs et charognards se précipitent sur la carcasse, arrachant des lambeaux de chair avec leurs dents, imprimant des marques de dans les os de l'animal. Le festin dure certainement plusieurs semaines, voire plusieurs mois. Voilà le scénario qu'ont pu reconstruire des chercheurs de l'université du Tennessee à partir de l'observation des restes fossilisés d'un Edmontosaure retrouvé en . Un d'autant plus surprenant qu'il possède encore des <strong>fragments</strong> de <strong>peau</strong> « momifiée ». Or, quelque chose cloche dans cette histoire, du moins si l'on se réfère . En effet, on considère habituellement que pour pouvoir préserver la structure de la <strong>peau</strong>, il est nécessaire que le <strong>corps</strong> de l'animal soit enseveli très rapidement après sa <strong>mort</strong>. Cela peut se produire notamment lorsque le <strong>corps</strong> est très vite recouvert par une coulée de boue, un glissement de terrain ou par des sédiments transportés par une soudaine inondation. Voilà les conditions considérées comme les plus propices à la momification de la <strong>peau</strong>. Dans le même temps, , ce qui le préserve d'autres dégradations. L'étude du <strong>squelette</strong> de l'Edmontosaure, <strong>dinosaure</strong> à bec de canard, montre bien la présence de de <strong>peau</strong> recouvrant les os de son membre antérieur droit, de ses membres postérieurs et de sa queue. La tête est manquante ainsi que l'extrémité de la queue, mais à part cela le <strong>squelette</strong> est entier. Mais, en 2018, lors d'un travail plus approfondi sur le <strong>fossile</strong>, les chercheurs ont identifié de nombreuses marques de morsure. Des empreintes de dents de crocodiliens ont ainsi été retrouvées dans divers os du <strong>dinosaure</strong>. Au niveau de la queue, la <strong>peau</strong> momifiée semble également porter des traces de perforation, certainement causées par des dents ou des griffes d'un autre . Il en est de même au niveau des antérieurs où la <strong>peau</strong> semble avoir été « pelée ». L'ensemble de ces marques suggère que la carcasse est restée un certain temps à l' libre, à la merci des prédateurs et des charognards. Mais comment, dans ce cas, expliquer que la <strong>peau</strong> ait été si bien conservée et n'ait pas subi de décomposition ? Pour les scientifiques, il ne fait pas de doute que le processus de momification peut également se faire d'une autre façon, qui ne nécessite pas un <strong>enfouissement</strong> <strong>rapide</strong>. Dans l'article publié dans la revue , les chercheurs expliquent ainsi que les charognards, et , en grignotant et nettoyant le <strong>corps</strong>, auraient pu le préparer à être fossilisé, notamment en protégeant la <strong>peau</strong> de toute décomposition. Les scientifiques font en effet appel à un processus bien connu des médecins légistes. Durant tout le temps que la carcasse aurait passé à l'air libre, insectes et microbes se seraient ainsi chargés de nettoyer le <strong>corps</strong> de ses organes internes, en faisant des trous à travers la <strong>peau</strong>. Ces petits trous auraient permis aux et aux fluides produits par la décomposition du <strong>corps</strong> de s'échapper, favorisant un « assèchement », voire une de la <strong>peau</strong>. Au bout de quelques semaines, le <strong>corps</strong> se serait donc retrouvé avec, littéralement, la <strong>peau</strong> sur les os. Le processus de momification est entamé. C'est à ce moment-là que le <strong>corps</strong>, ne contenant plus de « périssable », se serait retrouvé enfoui sous des sédiments et que le processus de en tant que tel aurait été entamé. C'est donc le « nettoyage » préalable à l'<strong>enfouissement</strong> qui aurait permis la momification de la <strong>peau</strong> et l'exceptionnelle <strong>préservation</strong> du <strong>corps</strong>. Reste maintenant à définir quelles exactement sont à l'origine de la momification de la <strong>peau</strong> dans de telles conditions. Ces résultats auraient également d'importantes conséquences, puisqu'il en résulterait que les fossiles portant encore des <strong>fragments</strong> de <strong>peau</strong> seraient bien plus fréquents que ce que l'on supposait jusqu'à présent. L'Edmontosaure du Dakota n'est en effet pas le seul spécimen à avoir été retrouvé avec de la <strong>peau</strong> momifiée. . Comparatifs et bons plans Maison Appareil électroménager Le lave-linge hublot Candy CSS1410TWMCBE-47 est en promotion sur Cdiscount Tech Jeux vidéo Bon plan Cdiscount : 110 € de réduction sur le volant de course Logitech G29 Tech Multimédia Cdiscount : l'écran incurvé PC gamer VIEWSONIC VX3218 est à bon prix Maison plastifieuse Le produit phare de notre comparatif des plastifieuses Tech Peugeot 2008 Les Peugeot 2008 - notre comparatif 2022 Tech chaise de bureau Nouvelles chaises de bureau ? Notre choix 2022 par Morgane Gillard le 14 octobre 2022 au sommaire Comparatifs et bons plans Maison Appareil électroménager Le lave-linge hublot Candy CSS1410TWMCBE-47 est en promotion sur Cdiscount Tech Jeux vidéo Bon plan Cdiscount : 110 € de réduction sur le volant de course Logitech G29 Tech Multimédia Cdiscount : l'écran incurvé PC gamer VIEWSONIC VX3218 est à bon prix Maison plastifieuse Le produit phare de notre comparatif des plastifieuses Tech Peugeot 2008 Les Peugeot 2008 - notre comparatif 2022 Tech chaise de bureau Nouvelles chaises de bureau ? Notre choix 2022",morocco,"top,science",french,incroyable-un-reste-de-dinosaure-decouvert-momifie-avec-des-traces-de-morsure-sur-sa-peau,1
2,Starlink : Elon Musk réclame des comptes aux États-Unis pour son aide aux Ukrainiens,https://www.futura-sciences.com/tech/actualites/technologie-starlink-elon-musk-reclame-comptes-etats-unis-son-aide-ukrainiens-101319/#xtor%3DRSS-8,futura,"elon,musk,veut,financer,starlink,ukraine,spacex,transmis,demande,pentagone,réclamant,centaines,millions,dollars,continuer","Edward Back,Journaliste hi-tech",https://cdn.futura-sciences.com/buildsv6/images/midioriginal/a/1/f/a1f8e9dabc_50160348_starlink-spacex.jpg,,Elon Musk ne veut plus financer Starlink en Ukraine. SpaceX aurait transmis une demande au Pentagone réclamant des centaines de millions de dollars pour continuer à assurer le service d’Internet par satellite dans le pays.,2022-10-14 11:45:00,"<strong>Elon</strong> <strong>Musk</strong> ne <strong>veut</strong> plus <strong>financer</strong> <strong>Starlink</strong> en <strong>Ukraine</strong>. SpaceX aurait <strong>transmis</strong> une <strong>demande</strong> au <strong>Pentagone</strong> <strong>réclamant</strong> des <strong>centaines</strong> de <strong>millions</strong> de <strong>dollars</strong> pour <strong>continuer</strong> à assurer le service d’Internet par satellite dans le pays. <strong>Elon</strong> <strong>Musk</strong>, l'homme le plus riche du monde, n'aurait plus les moyens de <strong>financer</strong> la connexion par satellite en <strong>Ukraine</strong>. , a demandé au <strong>Pentagone</strong> de couvrir les frais du service . Cette connexion, accessible même dans les zones dévastées par la guerre, s'est révélée cruciale dans la défense de l'<strong>Ukraine</strong>. Elle est notamment utilisée par les troupes pour les communications et pour faire fonctionner comme les , malgré les attaques russes sur l'infrastructure. Dans un tweet datant du 7 octobre, a déclaré que en <strong>Ukraine</strong> a coûté à SpaceX 80 <strong>millions</strong> de <strong>dollars</strong> jusqu'à présent, un montant qui devrait dépasser 100 <strong>millions</strong> d'ici la fin de l'année. Dans les documents envoyés au <strong>Pentagone</strong> avec ces lettres, ce montant est même estimé à 120 <strong>millions</strong> de <strong>dollars</strong> pour le reste de l'année, et pourrait atteindre 400 <strong>millions</strong> de <strong>dollars</strong> pour les 12 prochains mois. Une autre lettre incluse avec les documents a été envoyée directement à <strong>Elon</strong> <strong>Musk</strong> en juillet par le général Valeri Zaloujny, commandant en chef des forces armées ukrainiennes. Il demandait des milliers de terminaux supplémentaires. Il a indiqué que 4.000 terminaux avaient été déployés par les militaires, mais que 500 terminaux étaient détruits par mois dans les combats. Sa requête était de 6.200 terminaux de plus, ainsi que 500 par mois pour remplacer ceux qui sont détruits. SpaceX aurait refusé, en lui indiquant d'envoyer sa <strong>demande</strong> directement auprès du département de la Défense des États-Unis. « », a écrit Byron Hargis, directeur des ventes gouvernementales de SpaceX. Un constat appuyé par une autre lettre écrite par un consultant extérieur qui déclare que « ». SpaceX a tout de même reçu plusieurs financements, dont 3 <strong>millions</strong> de <strong>dollars</strong> de l'Agence des États‑Unis pour le développement international. Selon un tweet d'<strong>Elon</strong> <strong>Musk</strong>, il y aurait 25.000 terminaux en <strong>Ukraine</strong>, dont 9.000 achetés par la Pologne, 1.700 par les États-Unis, ainsi que des contributions provenant d'autres acteurs. Toutefois, SpaceX fournit le niveau de service le plus élevé à tous les terminaux en <strong>Ukraine</strong>, qui coûte 4.500 <strong>dollars</strong> par mois. Cette révélation tombe plutôt mal pour <strong>Elon</strong> <strong>Musk</strong>, qui accumule les controverses. Cela lui vaut de nombreuses critiques, y compris du président ukrainien . Les Ukrainiens ont constaté une absence de service dans les zones libérées de . <strong>Musk</strong> aurait coupé l'accès dans les zones occupées pour empêcher les Russes de s'en servir, mais cela pose des problèmes logistiques à l'armée ukrainienne et les oblige à notifier SpaceX de toute avancée. Le milliardaire a aussi décidé de s'immiscer dans la géopolitique et a proposé sur Twitter son propre plan de paix où l'<strong>Ukraine</strong> abandonnerait la Crimée et tiendrait des référendums supervisés par les Nations unies dans les quatre régions annexées. De plus, dans un entretien au , il a suggéré que Taïwan devienne une zone administrative spéciale de la Chine. De quoi inquiéter les Ukrainiens, sachant que l'accès à un service aussi crucial que dépend entièrement du bon vouloir d'un seul homme. Bons plans Tech Jeux vidéo Bon plan Cdiscount : 110 € de réduction sur le volant de course Logitech G29 Tech Multimédia Cdiscount : l'écran incurvé PC gamer VIEWSONIC VX3218 est à bon prix Tech Opérateur de téléphonie mobile Bouygues Telecom, Auchan Télécom ou Prixtel : les meilleurs forfaits mobiles du mois d'octobre Tech Télécoms Xiaomi 12T : un prix en dessous de 250 euros chez Bouygues Telecom Tech Vélo électrique Xiaomi Mi Smart Electric Folding : 200 € de réduction sur Cdiscount ! Tech Tech Smart TV Polaroid : réalisez 110 € d'économie grâce à ce bon plan Maison Appareil électroménager Cdiscount : incroyable promo sur le robot cuiseur Moulinex Companion XL par Edward Back le 14 octobre 2022 au sommaire Bons plans Tech Jeux vidéo Bon plan Cdiscount : 110 € de réduction sur le volant de course Logitech G29 Tech Multimédia Cdiscount : l'écran incurvé PC gamer VIEWSONIC VX3218 est à bon prix Tech Opérateur de téléphonie mobile Bouygues Telecom, Auchan Télécom ou Prixtel : les meilleurs forfaits mobiles du mois d'octobre Tech Télécoms Xiaomi 12T : un prix en dessous de 250 euros chez Bouygues Telecom Tech Vélo électrique Xiaomi Mi Smart Electric Folding : 200 € de réduction sur Cdiscount ! Tech Tech Smart TV Polaroid : réalisez 110 € d'économie grâce à ce bon plan Maison Appareil électroménager Cdiscount : incroyable promo sur le robot cuiseur Moulinex Companion XL",france,technology,french,starlink-elon-musk-reclame-des-comptes-aux-etats-unis-pour-son-aide-aux-ukrainiens,1
3,Bon plan Cdiscount : 110 € de réduction sur le volant de course Logitech G29,https://www.futura-sciences.com/tech/breves/jeux-video-bon-plan-cdiscount-110-reduction-volant-course-logitech-g29-4055/#xtor%3DRSS-8,futura-sciences,"amateurs,playstation,connaissent,volant,course,marque,logitech,piloter,voitures,préférées,sensation,réaliste,conduite,trajectoires,précises","Équipe Bons plans, Contenu avec affiliation",https://cdn.futura-sciences.com/buildsv6/images/midioriginal/1/4/1/1410eda9ae_50174204_volant-course-logitech.jpg,,Les amateurs de la PlayStation connaissent tous le volant de course de la marque Logitech qui permet de piloter vos voitures préférées avec une sensation plus réaliste de conduite. Les trajectoires sont plus précises lorsque l'on utilise cet accessoire et vous pourrez dépasser vos records....,2022-10-14 11:00:05,"Les <strong>amateurs</strong> de la PlayStation <strong>connaissent</strong> tous le <strong>volant</strong> de <strong>course</strong> de la <strong>marque</strong> <strong>Logitech</strong> qui permet de <strong>piloter</strong> vos <strong>voitures</strong> <strong>préférées</strong> avec une <strong>sensation</strong> plus <strong>réaliste</strong> de <strong>conduite</strong>. Les <strong>trajectoires</strong> sont plus <strong>précises</strong> lorsque l'on utilise cet accessoire et vous pourrez dépasser vos records. Faites ressortir le compétiteur en vous et vivez de nouvelles sensations fortes ! Ne passez pas à côté de cette offre, le <strong>volant</strong> de <strong>course</strong> <strong>LOGITECH</strong> G29 Driving Force est disponible au prix de . Bon plan Cdiscount Cliquez ici pour accéder à l'offre Le <strong>volant</strong> de <strong>course</strong> <strong>LOGITECH</strong> est compatible avec la PlayStation 5, PlayStation 4 et sur certains PC, la simulation de <strong>conduite</strong> est avancées pour une <strong>sensation</strong> incomparable. Vous aurez l'impression de conduire réellement sur vos circuits ! Le contrôle est précis, fluide et ferme, le système anti-jeu permet un bon maintien de position du <strong>volant</strong> et des pédales. Vous ressentez l'adhérence des pneus à chaque virage et freinage en fonction de chaque type de terrain. La conception du <strong>volant</strong> et des pédales sont robustes et le <strong>volant</strong> en cuir est cousu main. Le levier de vitesses et les pédales en acier inoxydable résisteront bien à l'utilisation et au temps. La commande de jeu est bien conçu et donne un accès direct aux différentes fonctionnalités (croix directionnelle, levier de vitesse, boutons). Des témoins lumineux vous indiquent le meilleur moment pour changer de vitesse. Si vous avez une préférence pour les jeux de voiture de <strong>course</strong> et que vous voulez investir dans un <strong>volant</strong> au top, vous serez très satisfait de ce <strong>volant</strong> <strong>LOGITECH</strong>. L'expérience de jeu est exceptionnelle sur PlayStation et vous en aurez pour votre argent grâce à ce bon plan Cdiscount. Un bon <strong>volant</strong> doit offrir un retour de force puissant, être réactif et dynamique et c'est le cas de ce dispositif. Un <strong>volant</strong> est plus confortable que les manettes pour des sessions de jeux inoubliables ! Vous aurez toujours hâte de recommencer une partie et serez prêt à repousser vos limites. La partie commence à vous de jouer, on compte sur vous pour réaliser des hautes performances ! Bon plan Cdiscount Cliquez ici pour accéder à l'offre Bon plan : <strong>Volant</strong> de <strong>Course</strong> <strong>LOGITECH</strong> © Cdiscount Bons plans Tech Multimédia Cdiscount : l'écran incurvé PC gamer VIEWSONIC VX3218 est à bon prix Tech Opérateur de téléphonie mobile Bouygues Telecom, Auchan Télécom ou Prixtel : les meilleurs forfaits mobiles du mois d'octobre Tech Télécoms Xiaomi 12T : un prix en dessous de 250 euros chez Bouygues Telecom Tech Vélo électrique Xiaomi Mi Smart Electric Folding : 200 € de réduction sur Cdiscount ! Tech Tech Smart TV Polaroid : réalisez 110 € d'économie grâce à ce bon plan Maison Appareil électroménager Cdiscount : incroyable promo sur le robot cuiseur Moulinex Companion XL Maison Appareil électroménager Four intégrable BOSCH : profitez de 284 € de réduction sur Cdiscount par Équipe Bons plans le 14 octobre 2022 au sommaire Bons plans Tech Multimédia Cdiscount : l'écran incurvé PC gamer VIEWSONIC VX3218 est à bon prix Tech Opérateur de téléphonie mobile Bouygues Telecom, Auchan Télécom ou Prixtel : les meilleurs forfaits mobiles du mois d'octobre Tech Télécoms Xiaomi 12T : un prix en dessous de 250 euros chez Bouygues Telecom Tech Vélo électrique Xiaomi Mi Smart Electric Folding : 200 € de réduction sur Cdiscount ! Tech Tech Smart TV Polaroid : réalisez 110 € d'économie grâce à ce bon plan Maison Appareil électroménager Cdiscount : incroyable promo sur le robot cuiseur Moulinex Companion XL Maison Appareil électroménager Four intégrable BOSCH : profitez de 284 € de réduction sur Cdiscount",morocco,"technology,science",french,bon-plan-cdiscount-110-eur-de-reduction-sur-le-volant-de-course-logitech-g29,1
