7,"Netflix : une date de sortie et un prix pour l'abonnement Essentiel avec pub, et enfin du 720p en Essentiel",https://gamergen.com/actualites/netflix-date-sortie-et-prix-abonnement-essentiel-pub-et-enfin-720p-essentiel-329651-1,gamergen,"temps,netflix,réfléchit,proposer,abonnement,publicités,toucher,public,prix,abordables,concurrent,positionné,annonçant,formule,mois","",http://global-img.gamergen.com/netflix-date-sortie-et-prix-abonnement-essentiel-pub-et-enfin-720p-essentiel_00FA009600976188.jpg,,"Avoir accès à presque tout le catalogue Netflix pour 5,99 € par mois ? C'est la promesse de l'abonnement Essentiel avec pub.",2022-10-14 08:26:46,"Cela fait quelque <strong>temps</strong> que <strong>Netflix</strong> <strong>réfléchit</strong> à <strong>proposer</strong> un <strong>abonnement</strong> avec <strong>publicités</strong> pour <strong>toucher</strong> un nouveau <strong>public</strong> avec des <strong>prix</strong> plus <strong>abordables</strong>. Son <strong>concurrent</strong> Disney+ s'était positionné le premier en <strong>annonçant</strong> une <strong>formule</strong> à 7,99 $ par <strong>mois</strong> à venir en fin d'année aux États-Unis, en en profitant pour rehausser le tarif de ses autres modes de souscription. <strong>Netflix</strong> , qui a déjà augmenté ses <strong>prix</strong> il y a un an , ne suivra pas cette voie. Il vient de confirmer qu'il allait lancer la <strong>formule</strong> Essentiel avec pub le 3 novembre dans 12 pays, dont la France, au <strong>prix</strong> de 5,99 € par <strong>mois</strong> . Elle sera proposée aux côtés des souscriptions Essentiel , Standard et Premium à 8,99 €, 15,99 € et 17,99 € par <strong>mois</strong>, en se basant sur l' Essentiel , qui bénéfice enfin du 720p après avoir été limité au 480p . Vous aurez donc accès à la quasi-intégralité des programmes (certains n'étant actuellement pas disponibles pour des raisons de droits), mais toujours pas aux téléchargements, en échange d'une moyenne d' un total de 4 à 5 minutes de publicité par heure avant et pendant les programmes . Nous sommes heureux d’annoncer le lancement en novembre d’Essentiel avec pub, le forfait le plus économique de <strong>Netflix</strong> qui inclut des <strong>publicités</strong>. Vos programmes préférés à un <strong>prix</strong> imbattable : Disponible à partir du 3 novembre à 17h00, Essentiel avec pub ne coûtera que 5,99 € par <strong>mois</strong> en France. Disponible dans 12 pays : Essentiel avec pub sera proposé en Allemagne, en Australie, au Brésil, au Canada, en Corée, aux États-Unis, en Espagne, en France, en Italie, au Japon, au Mexique et au Royaume-Uni. Un forfait pour chacun : Pas de changement pour les abonnés à nos offres actuelles. Essentiel avec pub complète notre gamme existante de forfaits sans publicité : Essentiel, Standard et Premium. Essentiel avec pub offre les mêmes options que le forfait Essentiel de <strong>Netflix</strong>, à quelques différences près : Ce qui ne change pas : un vaste choix de séries et de films ; une expérience personnalisée ; l’accès à <strong>Netflix</strong> sur la plupart des téléviseurs et appareils mobiles ; et la possibilité de modifier ou d’annuler votre forfait à tout moment. Ce qui est différent : la qualité vidéo jusqu’à 720p en HD (désormais proposée pour nos forfaits Essentiel avec pub et Essentiel) ; une moyenne de 4 à 5 minutes de publicité par heure ; quelques séries et films non disponibles en raison de restrictions liées aux droits sur certains titres (mais nous y travaillons) ; et le téléchargement des programmes hors ligne non compris. En résumé, Essentiel avec pub, c’est tout ce qu’on aime chez <strong>Netflix</strong>, à un <strong>prix</strong> plus attractif et avec quelques <strong>publicités</strong>. À compter de novembre, il sera possible de souscrire ce forfait très facilement : rendez-vous sur <strong>Netflix</strong>.com et inscrivez-vous en fournissant certaines informations comme votre adresse e-mail et votre date de naissance. Essentiel avec pub est aussi une opportunité à saisir pour les annonceurs : la possibilité de <strong>toucher</strong> un <strong>public</strong> varié, notamment les plus jeunes qui regardent de moins en moins la télévision, dans un environnement optimal et fluide avec des <strong>publicités</strong> en haute résolution. Format des <strong>publicités</strong> : Au lancement, des <strong>publicités</strong> de 15 à 30 secondes seront diffusées avant et pendant les programmes. Contrôles des annonceurs : Pour aider les annonceurs à atteindre leur <strong>public</strong> — et garantir que nos <strong>publicités</strong> soient adaptées aux consommateurs — nous offrirons des capacités de ciblage large par pays et par genre de programmes (action, drame, romance, science-fiction, etc.). Les annonceurs auront également la possibilité d’empêcher que leurs <strong>publicités</strong> soient associées à des programmes susceptibles d’être incompatibles avec leur image (comportant par exemple des images de sexe, de nudité ou de violence). Outils de vérification : Nous avons établi des partenariats avec DoubleVerify et Integral Ad Science afin de vérifier la visibilité et la validité du trafic de nos <strong>publicités</strong> à partir du premier trimestre 2023. Le lancement d’Essentiel avec pub intervient six <strong>mois</strong> seulement après notre première annonce d’une option de forfait plus économique. Rien de cela n’aurait été possible sans le dévouement de nos équipes et le partenariat qui nous lie à Microsoft. La transition de la télévision linéaire se produit à une vitesse de plus en plus élevée, le streaming dépassant maintenant la diffusion hertzienne et le câble aux États-Unis. Accessible dès 5,99 € par <strong>mois</strong>, <strong>Netflix</strong> propose désormais des forfaits adaptés à tous. Même s’il s’agit des tout premiers jours, nous sommes déjà très satisfaits de l’intérêt manifesté à la fois par les consommateurs et les annonceurs, et extrêmement impatients de découvrir ce que l’avenir nous réserve. Avec ce que nous apprendrons de cette expérience, nous avons l’ambition d’étendre ensuite l’offre à d’autres pays. De quoi vous donner envie de vous (ré)abonner à <strong>Netflix</strong> ? Vous pouvez pour cela vous procurer des cartes cadeaux sur la Fnac . Auxance Rédacteur Rédacteur préféré de ton rédacteur préféré depuis 2009, passionné de musique qui fait boom boom, adepte de séries comiques en tout genre. J'ai un peu trop joué à Pokémon dans ma vie. Me suivre :",france,technology,french,netflix-une-date-de-sortie-et-un-prix-pour-l-abonnement-essentiel-avec-pub-et-enfin-du-720p-en-essentiel,1
8,Robots monitor the environmental impact of the Nord Stream gas leak,https://phys.org/news/2022-10-robots-environmental-impact-nord-stream.html,phys,"october,university,gothenburg,deployed,underwater,robots,baltic,waters,leaks,nord,stream,gas,pipelines,follow,chemistry","",https://scx1.b-cdn.net/csz/news/tmb/2022/robots-monitor-the-env.jpg,,"The University of Gothenburg has deployed three underwater robots in the Baltic waters around the leaks on the Nord Stream gas pipelines. This is done to be able to follow how chemistry and life in the sea changes over time due to the large release of methane gas. In addition, research vessel Skagerak is set to deploy on a new expedition to the Baltic Sea to test run the large, unmanned vessel Ran.",2022-10-14 14:28:38,"<strong>October</strong> 14, 2022 by <strong>University</strong> of <strong>Gothenburg</strong> The <strong>University</strong> of <strong>Gothenburg</strong> has <strong>deployed</strong> three <strong>underwater</strong> <strong>robots</strong> in the <strong>Baltic</strong> <strong>waters</strong> around the <strong>leaks</strong> on the <strong>Nord</strong> <strong>Stream</strong> <strong>gas</strong> <strong>pipelines</strong>. This is done to be able to <strong>follow</strong> how <strong>chemistry</strong> and life in the sea changes over time due to the large release of methane <strong>gas</strong>. In addition, research vessel Skagerak is set to deploy on a new expedition to the <strong>Baltic</strong> Sea to test run the large, unmanned vessel Ran. googletag.cmd.push(function() { googletag.display('div-gpt-ad-1449240174198-2'); }); The expedition with R/V Skagerak was not the only measure the <strong>university</strong>'s researchers took when the <strong>Nord</strong> <strong>Stream</strong> <strong>pipelines</strong> began to leak methane <strong>gas</strong>. With the help of the Voice of the Ocean foundation, VOTO, three remote-controlled <strong>underwater</strong> <strong>robots</strong> were placed in the area. They will move around the sea and record water data continuously for the next 15 weeks. ""They are called gliders and are provided by VOTO, who also manages their operation. The <strong>robots</strong> can give us measurements over a series of time about how the <strong>chemistry</strong> and quality of the water is affected by the natural <strong>gas</strong> leak,"" says oceanographer Bastien Queste at the <strong>University</strong> of <strong>Gothenburg</strong>. Plenty of data from the area Since March 2021, VOTO has had two gliders in the area which functions as one of the foundation's ocean observatories and where the water quality is measured non-stop. The <strong>robots</strong> go down to the bottom and then turn up to the surface, something that is repeated over a preset distance. Every time the glider is at the surface, the latest measurement data is sent to the researchers via satellite. Thus, plenty of data from this area already exists from before. One of the three additional <strong>robots</strong> that was dropped into the sea last week has been equipped by the manufacturer Alseamar with a special sensor to be able to measure the change in the methane content over the next 15 weeks. ""Last week's expedition provided valuable data and a snapshot of the state of the ocean immediately after the leakage occurred. With the new <strong>robots</strong> in place, we receive continuous reports on the state of the water near the <strong>Nord</strong> <strong>stream</strong> pipeline <strong>leaks</strong>. They are <strong>deployed</strong> solely for this purpose,"" says Bastien Queste. ""The point is that we get measurements from the water over a long period of time and over a larger area. We can see how long it takes for the methane to disappear and how the aquatic environment reacts over time. The response in the sea is often delayed. It may take days or weeks before we see a change,"" says Bastien Queste. Even the <strong>underwater</strong> <strong>robots</strong> that are usually <strong>deployed</strong> there, can contribute important data as they measure salinity, temperature, oxygen content and the amount of chlorophyll. This completes the picture of how the water in the <strong>Baltic</strong> Sea is doing after the <strong>gas</strong> leak. Solid scientific documentation ""Together with the new <strong>robots</strong> and the expedition's measurements, we researchers will have solid scientific documentation of the impact of the <strong>Nord</strong> <strong>Stream</strong> leak. When we add it all up, we have a good picture of both the immediate and the delayed effects. With gliders that continuously measure, we will be able to better understand the processes that were observed then,"" says Bastien Queste. The expedition has barely had time to disembark before preparations for the next trip to the <strong>Baltic</strong> Sea with Skagerak have started. Polar researcher Anna Wåhlin had, for a long time, planned a trip with the ship precisely to the area east of Bornholm. ""I will test how the large <strong>underwater</strong> robot Ran behaves in seas with large layers of density and how well it can measure over sediment-rich bottoms. This place is perfect for that. Ran will also be able to contribute to research into <strong>gas</strong> emissions because it measures the carbon dioxide and nitrate levels in the water,"" says Anna Wåhlin. This is also the first time that Ran departs from Skagerak, which will be an important test of the ship's flexibility. Explore further","united states of america,united kingdom,australia,singapore",science,english,robots-monitor-the-environmental-impact-of-the-nord-stream-gas-leak,1
9,The tiny worm that can help treat trauma patients and facilitate long-distance human space travel,https://phys.org/news/2022-10-tiny-worm-trauma-patients-long-distance.html,phys,"october,university,oslo,dead,till,warm,googletag,cmd,push,function,display,reflects,clinical,observations,including","",https://scx1.b-cdn.net/csz/news/tmb/2022/the-tiny-worm-that-can.jpg,,"""You're not dead till you're warm and dead.""",2022-10-14 14:28:32,"<strong>October</strong> 14, 2022 by <strong>University</strong> of <strong>Oslo</strong> ""You're not <strong>dead</strong> <strong>till</strong> you're <strong>warm</strong> and <strong>dead</strong>."" <strong>googletag</strong>.<strong>cmd</strong>.<strong>push</strong>(<strong>function</strong>() { <strong>googletag</strong>.<strong>display</strong>('div-gpt-ad-1449240174198-2'); }); This saying <strong>reflects</strong> <strong>clinical</strong> <strong>observations</strong>, <strong>including</strong> those by doctors at the <strong>University</strong> hospital in Tromsø in Northern Norway, who have treated patients surviving several hours without a heartbeat, provided they were also very cold. In 1999, 29-year-old Anna Bågenholm survived a body temperature of 13.7 degrees Celsius (56.7 degrees Fahrenheit), after a skiing accident sent her under ice in a river. Her heart did not beat for several hours. The story was later relayed by the BBC. Now, a group of researchers in <strong>Oslo</strong> have come closer to explaining what happens in cells that experience deep cooling. Their work is relevant for both hibernation and accidental hypothermia. It has ramifications for treating trauma patients in hospitals, neurodegenerative diseases like Alzheimer's and Parkinson's and, in the future, might help humans travel in space. ""This project began quite a few years ago as an ambitious masters' project, where the student wanted to work on something cool. Obliging, we began studying proteins involved in cold responses,"" says Rafal Ciosk, professor in the Section for Biochemistry and Molecular Biology at the Department of Biosciences, <strong>University</strong> of <strong>Oslo</strong>. ""We started looking at them in our favorite model organism, the nematode Caenorhabditis elegans,"" he says. Better known as C. elegans, the tiny worm—just around 1 millimeter long—is widely used in biological research . It has won its ""exploiters"" three Nobel prizes. Hibernating worms prolong their lifespan Through their research, Ciosk and his colleagues realized how little is known about organismal responses to cold. They saw that if they cool the C. elegans in a particular way, they will survive for a very long time without affecting the total lifespan. The researchers kept the worms at 4 degrees Celsius (39.2 degrees Fahrenheit) for a week, then took them out from the cold and measured their lifespan. Remarkably, the total life span was a week longer than that of animals cultivated in the normal temperature. ""It looked like they were hibernating, and this is something that has not been described for this organism before,"" Ciosk says, and continues ""We started looking at what happens in this organism and, while doing genetics on this model, we realized that there are certain manipulations we can do that make the survival of these animals in the cold even more effective."" An iron storing protein is the key By following one particular manipulation, they realized that increasing the levels of a particular protein calledferritin, a protein that stores iron, strongly protected from cold. Iron is an essential element for us, however free iron can be toxic. Ferritins make huge nano cages that can accommodate thousands of iron atoms, thus making it possible to store and transport iron in a safe and non-toxic way. Ciosk explains they also tested whether this may be relevant for the mammalian cells. They chose neurons, nerve cells in the brain and nervous system, which are very sensitive cells. ""We found that when we induced ferritin in these cells, and exposed them to cold, the ferritin had protective effects,"" he says. The researchers also found that mimicking the effect of ferritin with drugs also had beneficial effects for the neurons. ""We were able to show that we can use a very simple model system and identify cold-protective pathways that are conserved in mammalian cells . This could open new ways to treat hypothermia and potentially neurodegenerative conditions,"" Ciosk says. Hibernating our way through space? You might think the tiny C. elegans worm has very little in common with humans. ""The physiology IS very different, but at the basic cellular level, many processes are conserved. The way the cell works is very similar across species,"" Ciosk explains. Hibernation is rare among primates, but there are examples of hibernating lemurs in Madagascar. ""In C. elegans and the neuron cells, we overexpressed ferritin and then showed that it has benefits. But, apparently, ferritin is expressed naturally in those hibernating primates. Possibly this is the way they survive the cold in nature,"" Ciosk says. Humans do not hibernate, but a hibernation-like sleep is suggested to facilitate long-distance space travel some time in the future. Cooling trauma patients to 10 degrees An application that is much nearer in time is cooling of patients in hospitals. Ciosk explains that cooling is used in several ways clinically. With moderate cooling, the patient's body temperature is lowered to 32–33 degrees Celsius (~90 Fahrenheit). In deep cooling, however, the body temperature will be lowered to approximately 10 degrees Celsius (50 Fahrenheit). ""This is in the range of hibernating animals,"" he says. There are <strong>clinical</strong> trials exploring deep cooling at a hospital in the U.S.. Relevant for diseases like Alzheimer's and Parkinson's The research conducted by the group in <strong>Oslo</strong> is also relevant for neurodegenerative diseases like Alzheimer's and Parkinson's. ""In the neurons we are experimenting on, we are looking at cold-related degeneration. A couple of years ago, a study showed that certain cold-induced proteins have protective effects against various neurodegenerative diseases ,"" Ciosk says. ""So, if you find how hibernators protect their neurons in the cold you may also find pathways that are relevant for patients,"" he explains. The next step for the researchers in <strong>Oslo</strong> is to take what they have found in C. elegans and cultured neurons and move it to an in vivo mammalian model. The research was published in Nature Communications . Explore further","united states of america,united kingdom,australia,singapore",science,english,the-tiny-worm-that-can-help-treat-trauma-patients-and-facilitate-long-distance-human-space-travel,1
10,Brazilian regulators: Sony would be harmed by Call of Duty exclusivity,https://www.tweaktown.com/news/88918/brazilian-regulators-sony-would-be-harmed-by-call-of-duty-exclusivity/index.html,tweaktown,"economic,competition,regulators,note,sony,materially,impacted,loss,call,duty,catastrophic,level,company,bit,ago","",https://www.tweaktown.com/images/news/8/8/88918_4_brazilian-regulators-sony-would-be-harmed-by-call-of-duty-exclusivity.png,,Brazilian competition regulator CADE says that Sony would be harmed by any Call of Duty exclusivity but not enough to cripple PlayStation's business. Continue reading at TweakTown >,2022-10-14 14:28:02,"Brazilian's <strong>economic</strong> <strong>competition</strong> <strong>regulators</strong> <strong>note</strong> that <strong>Sony</strong> would be <strong>materially</strong> <strong>impacted</strong> from the <strong>loss</strong> of <strong>Call</strong> of <strong>Duty</strong>, but at a <strong>catastrophic</strong> <strong>level</strong> for the <strong>company</strong>. A <strong>bit</strong> <strong>ago</strong>, Brazil's CADE regulatory body had approved the Microsoft-Activision merger without restrictions. The branch had published a 76-page document ( now 75 pages after a very important redaction ) outlining their reasoning behind the decision. Included in the document is discussion on <strong>Call</strong> of <strong>Duty</strong> exclusivity and what would happen to <strong>Sony</strong> if the franchise were made exclusive to Xbox. Microsoft has doubled-down on assertions that <strong>Call</strong> of <strong>Duty</strong> will remain on PlayStation, but for the sake of argument let's take a look at what CADE has to say about this situation. It's important to <strong>note</strong> that the <strong>regulators</strong> have privileged access to data figures, sales numbers, and other information that we simply don't. While I was able to determine that Activision made $1.32 billion from PlayStation in 2021, which meant that Activision-Blizzard products generated a total of $1.89 billion on PlayStation (assuming <strong>Sony</strong> kept a 30% commission and Activision got 70%), a good portion of the required data is just not made public. CADE rightly acknowledges that <strong>Call</strong> of <strong>Duty</strong> exclusivity would harm <strong>Sony</strong>. But this harm wouldn't be <strong>catastrophic</strong> nor would it force <strong>Sony</strong> to close its business. This is the main argument against <strong>Sony</strong>'s claims of <strong>Call</strong> of <strong>Duty</strong> being an ""essential franchise."" ""<strong>Sony</strong> is the only player in the game distribution market for consoles that could, in theory, be harmed by Microsoft's eventual exclusivity over the distribution of Activision Blizzard content,"" reads page 53 of the report. <strong>Sony</strong> made $7.93 billion from microtransactions in 2021, driven by hits like <strong>Call</strong> of <strong>Duty</strong>, Apex Legends, Fortnite, and other live games. Read Also: Brazilian <strong>regulators</strong> have myopic view on subscriptions like Game Pass <strong>Sony</strong> provided the <strong>regulators</strong> with exact earnings from <strong>Call</strong> of <strong>Duty</strong>'s microtransactions. Remember that <strong>Sony</strong> made over $7.9 billion from add-on content throughout calendar year 2021, which includes microtransactions and in-game purchases. According to CADE, <strong>Call</strong> of <strong>Duty</strong>'s proportion of PlayStation add-on content revenues were ""expressive, but not large enough so that their absence would force the PlayStation business to shut down. In Brazil, and other markets, anti-<strong>competition</strong> law is predicated on a simple question: Will this merger or acquisition force competitors out of business? CADE has determined that no, the Microsoft-Activision merger will not force PlayStation to close. ""In its response to the letter sent by SG, <strong>Sony</strong> reported that, in year 2021, Activision Blizzard represented [RESTRICTED ACCESS TO CADE] of total consumer spending on games and add-ons (""add-ons"") in the PlayStation ecosystem globally, and only <strong>Call</strong> of <strong>Duty</strong> responded by [RESTRICTED ACCESS TO CADE]. ""These percentages, although they are quite expressive, do not seem to reflect values ​​whose <strong>loss</strong> could effectively limit the ability of the console market leader in compete in the digital distribution segment, and they are certainly not sufficiently representative to the point of, by themselves, characterize the Activision Blizzard content as an ""essential input"" to the <strong>company</strong>'s business. Activision and Microsoft combined would be 14% of the global 2021 market. It's important to <strong>note</strong> that CADE is primarily focused on how the deal would affect Brazilian consumers and the domestic Brazilian games market. <strong>Call</strong> of <strong>Duty</strong> is not very popular in Brazil, and neither Microsoft nor Activision-Blizzard have generated substantial revenues in the region. This, combined with the market share data that shows that the combination of Microsoft and Activision-Blizzard would still be around 14% of the total global video games market in terms of revenues compared throughout 2021, has led CADE to make the assertion that the Microsoft-Activision merger poses no immediate threat to neither <strong>competition</strong> nor consumers. ""For all of the foregoing, although it is recognized that an eventual exclusivity over the distribution of Activision Blizzard's content may give Microsoft a competitive advantage, there is no evidence that such an advantage can, by itself, harm the performance of third parties to the point of limit <strong>competition</strong> in the market for digital distribution of electronic games."" Activision confirms it made $1.32 billion from PlayStation in 2021. We have no way of knowing how much PlayStation makes from <strong>Call</strong> of <strong>Duty</strong> every year, but based on a standard 30% split commission applied to the revenue from external customers outlined here, PlayStation earned over $570 million from Activision-Blizzard products.",united states of america,technology,english,brazilian-regulators-sony-would-be-harmed-by-call-of-duty-exclusivity,1
